News_URL,News_Source,News_Title,News_Date,News_Time,News_Authors,News_Authors_Source,News_Image_Link,News_Image_Caption,News_Proper_Nouns,News_Verbs,News_Cardinal_Digit,News_Target_Names,News_Total_Words,News_Total_Summary_Words,News_Word_Cloud,News_Summary_Word_Cloud,News_Short_Description,News_Detail,News_Summary,News_Polarity_Score,News_Subjectivity,News_Sentiments,News_Classification,News_Section,News_Event,News_Country,News_City,News_Address,News_Latitude,News_Longitude
https://aninews.in//news/national/politics/false-promises-of-aap-wont-work-in-mcd-elections-bjp-minister-anurag-thakur20221126142002,ANI Latest,False promises of AAP won't work in MCD elections: BJP Minister Anurag Thakur,2022-11-26,15:56:09,No Source,No Source Link,https://aniportalimages.s3.amazonaws.com/media/details/ANI-20221126084934.jpg,Union Minister Anurag Thakur,"['corruption', 'rally', 'leader', 'message', 'toKejriwalin', 'election', 'manifesto', 'place', 'civic', 'contest', 'theBJP', 'capital', 'theAAP', 'power', 'state.Delhi', 'andAAPleader', 'jail', 'connection', 'money', 'laundering', 'case.A', 'video', 'massage', 'controversy', 'treatment', 'footage', 'man', 'probe', 'formulation', 'implementation', 'state', 'excise', 'policy', 'charge', 'sheet', 'liquor', 'scam', 'New', 'Delhi', '[', 'India', ']', 'November', 'ANI', 'Union', 'MinisterAnurag', 'Thakuron', 'Saturday', 'Aam', 'Aadmi', 'Party', 'AAP', 'AAPchief', 'ArvindKejriwal', 'Thakur', 'Saturday.The', 'Bharatiya', 'Janata', 'BJP', 'People', 'Municipal', 'Corporation', 'MCD', 'December', 'Friday', 'Minister', 'Satyendar', 'Jain', 'June', 'VIP', 'CCTV', 'September', 'Deputy', 'Chief', 'Sisodia', 'FIR', 'Central', 'Bureau', 'Investigation', 'CBI', 'Manish']","['attacked', 'accused', 'engaging', 'involved', 'jailed', 'speaking', 'promises', 'scheduled', 'held', 'released', 'elections.The', 'counting', 'shaping', 'holds', 'arrested', 'surfaced', 'sparking', 'purported', 'dated', 'lying', 'bed', 'reading', 'sitting', 'massaging', 'registered', 'alleged', 'submitted', 'mentioned']","['26', '4', '7.The', '13', '2021-22.However']",Satyendar Jain,173,91,"['delhi', '[india],', 'november', '26', '(ani):', 'union', 'ministeranurag', 'thakuron', 'saturday', 'attacked', 'aam', 'aadmi', 'party', '(aap)', 'accused', 'leaders', 'engaging', 'corruption', 'scams.allaapministers', 'involved', 'allegations', 'corruption', 'jailed.', '(aapchief', 'arvindkejriwal', 's)', 'politics', 'corruption,', 'liquor', 'scams,', 'thakur', 'speaking', 'ani', 'public', 'rally', 'saturday.the', 'senior', 'bharatiya', 'janata', 'party', '(bjp)', 'leader', 'said,', 'people', 'clear', 'message', 'tokejriwalin', 'municipal', 'corporation', 'delhi', '(mcd)', 'election', 'false', 'promises', 'work.the', 'mcd', 'elections', 'scheduled', 'held', 'december', 'december', '4.', 'aam', 'aadmi', 'party', '(aap)', 'friday', 'released', '12-point', 'manifesto', 'mcd', 'elections.the', 'counting', 'votes', '250-ward', 'mcd', 'place', 'december', '7.the', 'civic', 'polls', 'shaping', 'two-way', 'contest', 'thebjp,', 'holds', 'civic', 'reins', 'national', 'capital,', 'theaap,', 'power', 'state.delhi', 'minister', 'andaapleader,', 'satyendar', 'jain,', 'arrested', 'jail', 'june', 'connection', 'money', 'laundering', 'case.a', 'video', 'full-body', 'massage', 'surfaced', 'social', 'media', 'sparking', 'controversy', 'minister', 'vip', 'treatment', 'held', 'crime.the', 'purported', 'cctv', 'footage', 'dated', 'september', '13', 'minister', 'lying', 'bed', 'reading', 'papers', 'man', 'sitting', 'massaging', 'foot.delhi', 'deputy', 'chief', 'minister', 'andaapleader,', 'manish', 'sisodia,', 'prime', 'accused', 'fir', 'registered', 'central', 'bureau', 'investigation', '(cbi)', 'probe', 'alleged', 'irregularities', 'formulation', 'implementation', 'state', 'excise', 'policy', '2021-22.however,', 'charge', 'sheet', 'submitted', 'cbi', 'liquor', 'scam', 'friday', 'deputy', 'chief', 'minister', 'delhi', 'manish', 'sisodia', 'mentioned', 'fir', 'connection', 'scam.', '(ani)']","['(aapchief', 'arvindkejriwal', 's)', 'politics', 'corruption,', 'liquor', 'scams,', 'thakur', 'speaking', 'ani', 'public', 'rally', 'saturday.', 'senior', 'bharatiya', 'janata', 'party', '(bjp)', 'leader', 'said,', 'people', 'clear', 'message', 'tokejriwalin', 'municipal', 'corporation', 'delhi', '(mcd)', 'election', 'false', 'promises', 'work.', 'delhi', '[india],', 'november', '26', '(ani):', 'union', 'ministeranurag', 'thakuron', 'saturday', 'attacked', 'aam', 'aadmi', 'party', '(aap)', 'accused', 'leaders', 'engaging', 'corruption', 'scams.', 'delhi', 'minister', 'andaapleader,', 'satyendar', 'jain,', 'arrested', 'jail', 'june', 'connection', 'money', 'laundering', 'case.', 'aam', 'aadmi', 'party', '(aap)', 'friday', 'released', '12-point', 'manifesto', 'mcd', 'elections.', 'video', 'full-body', 'massage', 'surfaced', 'social', 'media', 'sparking', 'controversy', 'minister', 'vip', 'treatment', 'held', 'crime.', 'allaapministers', 'involved', 'allegations', 'corruption', 'jailed.']",The MCD elections are scheduled to be held on December on December 4. The Aam Aadmi Party (AAP) on Friday released its 12-point manifesto for the MCD elections.,"New Delhi [India], November 26 (ANI): Union MinisterAnurag Thakuron Saturday attacked the Aam Aadmi Party (AAP) and accused its leaders of engaging in corruption and scams.AllAAPministers are not only involved in serious allegations of corruption but also jailed. This shows that his (AAPchief ArvindKejriwal s) politics is only about corruption, liquor and scams, said Thakur while speaking to ANI during a public rally on Saturday.The senior Bharatiya Janata Party (BJP) leader said, People want to give a clear message toKejriwalin the Municipal Corporation of Delhi (MCD) election that false promises won t work.The MCD elections are scheduled to be held on December on December 4. The Aam Aadmi Party (AAP) on Friday released its 12-point manifesto for the MCD elections.The counting of votes for the 250-ward MCD will take place on December 7.The civic polls are shaping up to be a two-way contest between theBJP, which currently holds the civic reins in the national capital, and theAAP, which is in power in the state.Delhi Minister andAAPleader, Satyendar Jain, was arrested and in jail since June in connection to a money laundering case.A video of him getting a full-body massage surfaced on social media recently sparking a controversy about the Minister getting a VIP treatment despite being held for a crime.The purported CCTV footage dated September 13 showed the Minister lying on his bed and reading some papers while a man sitting next to him is seen massaging his foot.Delhi s Deputy Chief Minister andAAPleader, Manish Sisodia, was also made the prime accused in an FIR registered by the Central Bureau of Investigation (CBI) to probe alleged irregularities in the formulation and implementation of the new state excise policy 2021-22.However, the charge sheet submitted by the CBI in the liquor scam on Friday did not name the Deputy Chief Minister of Delhi Manish Sisodia who was mentioned in the FIR in the connection with the scam. (ANI)","This shows that his (AAPchief ArvindKejriwal s) politics is only about corruption, liquor and scams, said Thakur while speaking to ANI during a public rally on Saturday. The senior Bharatiya Janata Party (BJP) leader said, People want to give a clear message toKejriwalin the Municipal Corporation of Delhi (MCD) election that false promises won t work. New Delhi [India], November 26 (ANI): Union MinisterAnurag Thakuron Saturday attacked the Aam Aadmi Party (AAP) and accused its leaders of engaging in corruption and scams. Delhi Minister andAAPleader, Satyendar Jain, was arrested and in jail since June in connection to a money laundering case. The Aam Aadmi Party (AAP) on Friday released its 12-point manifesto for the MCD elections. A video of him getting a full-body massage surfaced on social media recently sparking a controversy about the Minister getting a VIP treatment despite being held for a crime. AllAAPministers are not only involved in serious allegations of corruption but also jailed.",-0.007954545454545457,0.3995265151515151,Weakly Negative,Politics,No Section,scheduled held released,India,Delhi,"Delhi, Kotwali Tehsil, Central Delhi, Delhi, 110006, India",28.6517178,77.2219388
https://aninews.in//news/national/general-news/rajasthan-three-shot-dead-in-a-violent-clash-between-two-groups20221127090012,ANI Latest,Rajasthan: Three shot dead in a violent clash between two groups,2022-11-27,15:56:12,No Source,No Source Link,https://aniportalimages.s3.amazonaws.com/media/details/ANI-20221127032959.jpg,"ASP, Bharatpur Anil Meena (Photo/ANI)","['fight', 'district', 'police', 'village', 'ofKumherin', 'injured.Two', 'dist', 'hospital.Further', 'Bharatpur', 'Rajasthan', 'India', ']', 'November', 'ANI', 'Sunday.As', 'Sakraura', 'Thebrawlbroke', 'Samundar', 'Lakhan', 'Anil', 'Meena.The', 'Ishwar', 'Gajendra.ASP', 'Meena']","['[', 'broke', 'led', 'fired', 'theBharatpur', 'engaged', 'died', 'firing', 'abrawlin', 'ensued', 'deceased', 'identified', 'injured', 'rushed', 'awaited']",['27'],"Samundar, Bharatpur Anil Meena, Bharatpur Anil Meena, Bharatpur",71,51,"['bharatpur', '(rajasthan)', '[india],', 'november', '27', '(ani):', 'violent', 'fight', 'broke', 'groups', 'bharatpur', 'district', 'led', 'shots', 'fired,', 'deaths', 'severe', 'injuries,', 'informed', 'police', 'officials', 'sunday.as', 'thebharatpur', 'police,', 'groups', 'engaged', 'violent', 'fight', 'sakraura', 'village', 'ofkumherin', 'bharatpur', 'district,', 'people', 'died', 'firing', 'injured.two', 'groups', 'abrawlin', 'sakraura', 'village', 'ofkumherin', 'bharatpur', 'dist.', 'thebrawlbroke', 'samundar', 'lakhan', 'groups', 'people', 'died', 'firing', 'ensued', 'injured,', 'saidasp,', 'bharatpur', 'anil', 'meena.the', 'deceased', 'identified', 'samundar,', 'ishwar', 'gajendra.asp,', 'bharatpur', 'anil', 'meena', 'injured', 'rushed', 'hospital.further', 'details', 'awaited.', '(ani)']","['thebharatpur', 'police,', 'groups', 'engaged', 'violent', 'fight', 'sakraura', 'village', 'ofkumherin', 'bharatpur', 'district,', 'people', 'died', 'firing', 'injured.', 'thebrawlbroke', 'samundar', 'lakhan', 'groups', 'people', 'died', 'firing', 'ensued', 'injured,', 'saidasp,', 'bharatpur', 'anil', 'meena.', 'asp,', 'bharatpur', 'anil', 'meena', 'injured', 'rushed', 'hospital.', 'deceased', 'identified', 'samundar,', 'ishwar', 'gajendra.', 'groups', 'abrawlin', 'sakraura', 'village', 'ofkumherin', 'bharatpur', 'dist.', 'details', 'awaited.', 'bharatpur', '(rajasthan)']","As per the Bharatpur police, two groups engaged in a violent fight in Sakraura village of Kumher in Bharatpur district, in which three people died in firing while three others were injured.","Bharatpur (Rajasthan) [India], November 27 (ANI): A violent fight broke out between two groups in the Bharatpur district which led to shots being fired, three deaths and severe injuries, informed the police officials on Sunday.As per theBharatpur police, two groups engaged in a violent fight in Sakraura village ofKumherin Bharatpur district, in which three people died in firing while three others were injured.Two groups had abrawlin Sakraura village ofKumherin Bharatpur dist. Thebrawlbroke out between Samundar and Lakhan groups in which three people died in firing that ensued while three others were injured, saidASP, Bharatpur Anil Meena.The three deceased have been identified as Samundar, Ishwar and Gajendra.ASP, Bharatpur Anil Meena said that the injured were rushed to the hospital.Further details are awaited. (ANI)","As per theBharatpur police, two groups engaged in a violent fight in Sakraura village ofKumherin Bharatpur district, in which three people died in firing while three others were injured. Thebrawlbroke out between Samundar and Lakhan groups in which three people died in firing that ensued while three others were injured, saidASP, Bharatpur Anil Meena. ASP, Bharatpur Anil Meena said that the injured were rushed to the hospital. The three deceased have been identified as Samundar, Ishwar and Gajendra. Two groups had abrawlin Sakraura village ofKumherin Bharatpur dist. Further details are awaited. Bharatpur (Rajasthan)",-0.8,1.0,Very Negative,Sport,No Section,engaged died firing injured,India,Bharatpur,"Bharatpur, Chitwan, Bagmati Pradesh, Nepal",27.6879749,84.43608261590491
https://aninews.in//news/national/general-news/delhi-man-kills-father-chops-him-into-bits-and-stores-pieces-in-fridge-mother-helps-in-murder20221128121218,ANI Latest,"Delhi man kills father, chops him into bits and stores pieces in fridge; mother helps in murder",2022-11-28,15:56:13,No Source,No Source Link,https://aniportalimages.s3.amazonaws.com/media/details/UnDZFSGDStitled-2.jpg,"Visuals of CCTV footage, confirmed by police (Photo/ANI)","['resemblance', 'murder', 'case', 'woman', 'son', 'husband', 'refrigerator.Police', 'man', 'mother', 'body', 'place', 'capital.The', 'hideout', 'midnight', 'person', 'girlfriend', 'year', 'refrigerator', 'Delhi', 'custody', 'test', 'today.Further', 'New', '[', 'India', ']', 'November', 'ANI', 'Shraddha', 'Walkar', 'Police', 'Monday', 'Trilokpuri', 'Pandav', 'Nagar', 'East', 'Chand', 'Cinema', 'Aaftab', 'Poonawala', 'Shradda', 'May', 'HE', 'South', 'Gurgaon.The']","['chilling', 'arrested', 'killing', 'chopping', 'storing', 'killed', 'chopped', 'refrigerator.The', 'added.Police', 'set', 'caught', 'wake', 'accused', 'stored', 'disposed', 'forested', 'undergoing', 'awaited']","['28', '35']",Chand Cinema,98,55,"['delhi', '[india],', 'november', '28', '(ani):', 'chilling', 'resemblance', 'shraddha', 'walkar', 'murder', 'case,', 'delhi', 'police', 'monday', 'arrested', 'woman', 'son', 'allegedly', 'killing', 'husband', 'chopping', 'pieces', 'storing', 'bits', 'refrigerator.police', 'man', 'killed', 'father', 'mother,', 'chopped', 'body', 'pieces', 'refrigerator.the', 'incident', 'place', 'trilokpuri', 'national', 'capital.the', 'body', 'parts', 'thrown', 'areas', 'pandav', 'nagar', 'east', 'delhi,', 'officials', 'added.police', 'set', 'hideout', 'set', 'midnight', 'chand', 'cinema', 'caught', 'person', 'act.the', 'case', 'wake', 'sensational', 'murder', 'case', 'accused', 'aaftab', 'poonawala', 'allegedly', 'killed', 'live-in', 'girlfriend', 'shradda', 'walkar', 'year', 'chopped', 'body', '35', 'parts.', 'stored', 'chopped', 'parts', 'refrigerator', 'gradually', 'disposed', 'forested', 'areas', 'south', 'delhi', 'gurgaon.the', 'accused', 'delhi', 'police', 'custody', 'undergoing', 'polygraph', 'test', 'today.further', 'details', 'awaited.', '(ani)']","['police', 'man', 'killed', 'father', 'mother,', 'chopped', 'body', 'pieces', 'refrigerator.', 'body', 'parts', 'thrown', 'areas', 'pandav', 'nagar', 'east', 'delhi,', 'officials', 'added.', 'stored', 'chopped', 'parts', 'refrigerator', 'gradually', 'disposed', 'forested', 'areas', 'south', 'delhi', 'gurgaon.', 'police', 'set', 'hideout', 'set', 'midnight', 'chand', 'cinema', 'caught', 'person', 'act.', 'accused', 'delhi', 'police', 'custody', 'undergoing', 'polygraph', 'test', 'today.', 'incident', 'place', 'trilokpuri', 'national', 'capital.', 'details', 'awaited.']","In a chilling resemblance to the Shraddha Walkar murder case, Delhi Police on Monday arrested a woman and her son allegedly for killing her husband and chopping him into pieces and then storing the bits in a refrigerator.","New Delhi [India], November 28 (ANI): In a chilling resemblance to the Shraddha Walkar murder case, Delhi Police on Monday arrested a woman and her son allegedly for killing her husband and chopping him into pieces and then storing the bits in a refrigerator.Police said that the man killed his father with the help of his mother, chopped his body into pieces and kept them in the refrigerator.The incident took place at Trilokpuri in the national capital.The body parts were thrown in different areas of Pandav Nagar and East Delhi, officials added.Police set up a hideout was set up after midnight in front of Chand Cinema and caught the person in the act.The case follows in the wake of the sensational murder case in which accused Aaftab Poonawala allegedly killed his live-in girlfriend Shradda Walkar in May this year and chopped her body into 35 parts. HE stored the chopped parts in a refrigerator and gradually disposed them off in the forested areas of South Delhi and Gurgaon.The accused is currently in Delhi Police custody and is undergoing a polygraph test today.Further details awaited. (ANI)","Police said that the man killed his father with the help of his mother, chopped his body into pieces and kept them in the refrigerator. The body parts were thrown in different areas of Pandav Nagar and East Delhi, officials added. HE stored the chopped parts in a refrigerator and gradually disposed them off in the forested areas of South Delhi and Gurgaon. Police set up a hideout was set up after midnight in front of Chand Cinema and caught the person in the act. The accused is currently in Delhi Police custody and is undergoing a polygraph test today. The incident took place at Trilokpuri in the national capital. Further details awaited.",-0.02462121212121212,0.39015151515151514,Weakly Negative,Entertainment,No Section,arrested killing chopping storing,India,Police,"Police, gmina Police, Police County, West Pomeranian Voivodeship, Poland",53.5486435,14.5657399
