News_URL,News_Source,News_Title,News_Date,News_Time,News_Authors,News_Authors_Source,News_Image_Link,News_Image_Caption,News_Proper_Nouns,News_Verbs,News_Cardinal_Digit,News_Target_Names,News_Total_Words,News_Total_Summary_Words,News_Word_Cloud,News_Summary_Word_Cloud,News_Short_Description,News_Detail,News_Summary,News_Polarity_Score,News_Subjectivity,News_Sentiments,News_Classification,News_Section,News_Event,News_Country,News_City,News_Address,News_Latitude,News_Longitude
https://aninews.in//news/sports/cricket/wait-for-right-time-no-country-can-overlook-india-anurag-thakur-on-ramiz-rajas-remarks-about-world-cup-202320221126211449,ANI Latest,"""Wait for right time, no country can overlook India"": Anurag Thakur on Ramiz Raja's remarks about World Cup 2023",2022-11-26,15:56:18,No Source,No Source Link,https://aniportalimages.s3.amazonaws.com/media/details/ANI-20221126154430.jpg,Union Sports Minister Anurag Thakur (Photo/ANI),"['power', 'country', 'overlook', 'query', 'chairman', 'time', 'secretary', 'venue.After', 'venue', 'statement', 'impact', 'visit', 'split', 'future', 'cycle', 'host', 'matter', 'issue', 'year', 'board', 'government', 'decision', 'event', 'return', 'edition', 'tournament', 'New', 'Delhi', '[', 'India', ']', 'November', 'ANI', 'Union', 'Sports', 'Minister', 'Anurag', 'Thakur', 'Pakistan', 'Cricket', 'Board', 'PCB', 'Ramiz', 'Raja', 'Asia', 'Cup', 'World', 'India.Wait', 'October', 'BCCI', 'Jay', 'Shah', 'ICC', 'Events', 'WC', 'October.BCCI', 'President', 'Roger', 'Binny', 'Sri', 'Lanka', 'Bangladesh']","['ofsportsand', 'country.He', 'responding', 'hosted', 'held', 'holding', 'issued', 'internationalcricketing', 'Following', 'teams.It', 'handle', 'wrong', 'hosting', 'participated', 'host', 'play', 'touring', 'team', 'clearance', 'leave', 'said.2023', 'marqueecricketing', 'emerged']","['26', '2023', '2023The', '1987', '1996', '2011']","Roger Binny, Jay Shah",187,65,"['delhi', '[india],', 'november', '26', '(ani):', 'union', 'sports', 'minister', 'anurag', 'thakur', 'india', 'major', 'power', 'ofsportsand', 'country', 'overlook', 'country.he', 'responding', 'query', 'remarks', 'pakistan', 'cricket', 'board', '(pcb)', 'chairman', 'ramiz', 'raja', 'india', 'asia', 'cup,', 'pakistan', '2023', 'cup', 'hosted', 'india.wait', 'time.', 'india', 'major', 'power', 'ofsports&', 'country', 'overlook', 'india,', 'thakur', 'said.earlier', 'october,', 'bcci', 'secretary', 'jay', 'shah', 'asia', 'cup', 'held', 'neutral', 'venue.after', 'shah', 'remarks', 'holding', 'asia', 'cup', 'neutral', 'venue,', 'pcb', 'issued', 'statement', 'impact', 'pakistan', 'visit', 'india', 'icc', 'cricket', 'cup', '2023the', 'impact', 'statements', 'potential', 'split', 'asian', 'internationalcricketing', 'communities', 'impact', 'pakistan', 'visit', 'india', 'icc', 'cricket', 'cup', '2023', 'future', 'icc', 'events', 'india', '2024-2031', 'cycle,', 'pcb', 'said,following', 'pcb', 'statement,', 'thakur', 'india', 'host', '2023', 'wc', 'teams.it', 'internal', 'matter', 'bcci', 'handle', 'issue', 'smartly.', 'wrong', 'hosting', 'international', 'tournaments', 'before.', 'hosted', 'cup', 'teams', 'participated', 'happily.', 'host', 'tournament', 'year', 'teams', 'play', 'it,', 'thakur', 'october.bcci', 'president', 'roger', 'binny', 'touring', 'pakistan', 'asia', 'cup', '2023', 'board', 'call,', 'rely', 'government', 'decision.that', 'call.', 'team', 'go.', 'clearance', 'government', 'leave', 'country,', 'countries', 'here.', 'decision', 'own,', 'rely', 'government,', 'binny', 'said.2023', 'mark', 'time', 'india', 'host', 'marqueecricketing', 'event', 'itself.', 'co-hosted', '1987', 'cup', 'pakistan', '1996', 'cup', 'pakistan', 'sri', 'lanka.', 'tournament', 'return', 'india', '2011', 'co-hosted', 'sri', 'lanka', 'bangladesh.', 'india', 'emerged', 'victorious', '2011', 'edition', 'tournament.', '(ani)']","['bcci', 'president', 'roger', 'binny', 'touring', 'pakistan', 'asia', 'cup', '2023', 'board', 'call,', 'rely', 'government', 'decision.', 'india', 'major', 'power', 'ofsports&', 'country', 'overlook', 'india,', 'thakur', 'said.', 'host', 'tournament', 'year', 'teams', 'play', 'it,', 'thakur', 'october.', 'clearance', 'government', 'leave', 'country,', 'countries', 'here.', 'earlier', 'october,', 'bcci', 'secretary', 'jay', 'shah', 'asia', 'cup', 'held', 'neutral', 'venue.', 'co-hosted', '1987', 'cup', 'pakistan', '1996', 'cup', 'pakistan', 'sri', 'lanka.', 'tournament', 'return', 'india', '2011', 'co-hosted', 'sri', 'lanka', 'bangladesh.']","The minister was responding to a query about remarks of Pakistan Cricket Board (PCB) chairman Ramiz Raja that if India does not come for Asia Cup, Pakistan won't go for 2023 World Cup to be hosted by India.","New Delhi [India], November 26 (ANI): Union Sports Minister Anurag Thakur has said India is a major power in the world ofsportsand no country can overlook the country.He was responding to a query about remarks of Pakistan Cricket Board (PCB) chairman Ramiz Raja that if India does not come for Asia Cup, Pakistan won t go for 2023 World Cup to be hosted by India.Wait for the right time. India is a major power in the world ofsports& no country can overlook India, Thakur said.Earlier in October, BCCI secretary Jay Shah had indicated that Asia Cup could be held at a neutral venue.After Shah s remarks about holding Asia Cup at a neutral venue, PCB issued a statement it can impact Pakistan s visit to India for the ICC Cricket World Cup 2023The overall impact of such statements has the potential to split the Asian and internationalcricketing communities and can impact Pakistan s visit to India for the ICC Cricket World Cup 2023 and future ICC Events in India in the 2024-2031 cycle, PCB said,Following PCB s statement, Thakur had said that India will host the 2023 WC with all teams.It is an internal matter of BCCI and it will handle the issue smartly. We have not done anything wrong yet while hosting international tournaments before. We have hosted World Cup successfully before and all teams participated happily. We will host the tournament next year and all teams will play in it, Thakur had said in October.BCCI President Roger Binny also said that touring Pakistan for Asia Cup 2023 is not the board s call, but they will rely on the government s decision.That is not our call. We cannot say where our team has to go. We need to take clearance from the government if we leave the country, or other countries come here. We cannot take that decision on our own, we have to rely on the government, Binny had said.2023 will mark the first time ever that India will host the marqueecricketing event by itself. It co-hosted the 1987 World Cup with Pakistan and the 1996 World Cup with Pakistan and Sri Lanka. The tournament made its return to India in 2011 when it co-hosted it along with Sri Lanka and Bangladesh. India also emerged victorious in the 2011 edition of the tournament. (ANI)","BCCI President Roger Binny also said that touring Pakistan for Asia Cup 2023 is not the board s call, but they will rely on the government s decision. India is a major power in the world ofsports& no country can overlook India, Thakur said. We will host the tournament next year and all teams will play in it, Thakur had said in October. We need to take clearance from the government if we leave the country, or other countries come here. Earlier in October, BCCI secretary Jay Shah had indicated that Asia Cup could be held at a neutral venue. It co-hosted the 1987 World Cup with Pakistan and the 1996 World Cup with Pakistan and Sri Lanka. The tournament made its return to India in 2011 when it co-hosted it along with Sri Lanka and Bangladesh.",0.13349282296650716,0.464023695602643,Weakly Positive,Sport,No Section,responding come go hosted,India,New,"New, Owen County, Kentucky, United States",38.4278468,-84.8105037
https://aninews.in//news/national/general-news/up-fire-breaks-out-in-sikandrabads-mattress-factory20221127064715,ANI Latest,UP: Fire breaks out in Sikandrabad's mattress factory,2022-11-27,15:56:19,No Source,No Source Link,https://aniportalimages.s3.amazonaws.com/media/details/ANI-20221127011649.jpg,Visuals from the spot (Photo/ANI),"['massivefirebroke', 'mattress', 'factory', 'area', 'district.Fire', 'spot.No', 'Bulandshahr', 'Uttar', 'Pradesh', 'India', ']', 'November', 'ANI', 'Sikandrabad', 'Saturday']","['[', 'reported', 'rushed', 'awaited']",['27'],Bulandshahr,30,31,"['bulandshahr', '(uttar', 'pradesh)', '[india],', 'november', '27', '(ani):', 'massivefirebroke', 'uttar', 'pradesh', 'sikandrabad', 'saturday', 'night.thefirewas', 'reported', 'erupted', 'mattress', 'factory', 'sikandrabad', 'area', 'bulandshahr', 'district.fire', 'tenders', 'rushed', 'incident', 'spot.no', 'casualties', 'reported', 'far.further', 'awaited.', '(ani)']","['[india],', 'november', '27', '(ani):', 'massivefirebroke', 'uttar', 'pradesh', 'sikandrabad', 'saturday', 'night.', 'thefirewas', 'reported', 'erupted', 'mattress', 'factory', 'sikandrabad', 'area', 'bulandshahr', 'district.', 'tenders', 'rushed', 'incident', 'spot.', 'casualties', 'reported', 'far.', 'awaited.', 'bulandshahr', '(uttar', 'pradesh)', '(ani)']",The fire was reported to have erupted in a mattress factory in the Sikandrabad area of Bulandshahr district.,"Bulandshahr (Uttar Pradesh) [India], November 27 (ANI): A massivefirebroke out in Uttar Pradesh s Sikandrabad on Saturday night.Thefirewas reported to have erupted in a mattress factory in the Sikandrabad area of Bulandshahr district.Fire tenders were rushed to the incident spot.No casualties have been reported so far.Further information is awaited. (ANI)","[India], November 27 (ANI): A massivefirebroke out in Uttar Pradesh s Sikandrabad on Saturday night. Thefirewas reported to have erupted in a mattress factory in the Sikandrabad area of Bulandshahr district. Fire tenders were rushed to the incident spot. No casualties have been reported so far. Further information is awaited. Bulandshahr (Uttar Pradesh) (ANI)",0.0,0.0,Neutral,Sport,No Section,reported erupted,India,Bulandshahr,"Bulandshahr, Uttar Pradesh, India",28.38886085,77.97479772598118
https://aninews.in//news/national/general-news/four-people-injured-after-slabs-of-foot-over-bridge-collapse-at-balharshah-station-in-maharashtra20221127190637,ANI Latest,Four people injured after slabs of foot-over bridge collapse at Balharshah station in Maharashtra ,2022-11-27,15:56:20,No Source,No Source Link,https://aniportalimages.s3.amazonaws.com/media/details/ANI-20221127133617.jpg,Visuals from the spot (Photo/ANI),"['portion', 'bridge', 'station', 'causality', 'railway', 'foot', 'over-bridge', 'division', 'today', 'Relations', 'slab', 'walkway', 'Chandrapur', 'Maharashtra', 'India', ']', 'November', 'ANI', 'Junctionrailway', 'Chandrapur.All', 'Civil', 'Hospital', 'FOB', 'Balharshah', 'Nagpur', 'Officer', 'Central', 'Railways', 'Shivaji', 'Sutar', 'Pre-case', 'Saturday']","['[', 'collapsed', 'shifted', 'reported', 'fell', 'connecting', 'fallen', 'mentioned', 'awaited']","['27', 'Four', '5.10', '1', '2']",Nagpur,71,51,"['chandrapur', '(maharashtra)', '[india],', 'november', '27', '(ani):', 'people', 'injured', 'portion', 'foot-over', 'bridge', 'collapsed', 'atbalharshah', 'junctionrailway', 'station', 'chandrapur.all', 'shifted', 'civil', 'hospital', 'aid.however,', 'causality', 'reported', 'far.according', 'railway', 'officials,', 'pre-cast', 'slab', 'foot', 'over-bridge', '(fob)', 'balharshah,', 'nagpur', 'division', 'fell', 'today', '5.10', 'pm.chief', 'public', 'relations', 'officer', 'central', 'railways,', 'shivaji', 'sutar,', 'said,', 'pre-case', 'slab', 'fob', 'balharshah', 'railway', 'station', 'connecting', 'platforms', '1', '2', 'fallen', '5.10', 'saturday.', 'mentioned', 'fob', 'fallen', 'down,', 'pre-cast', 'slab', '(a', 'small', 'walkway', ').further', 'reports', 'awaited.', '(ani)']","['railway', 'officials,', 'pre-cast', 'slab', 'foot', 'over-bridge', '(fob)', 'balharshah,', 'nagpur', 'division', 'fell', 'today', '5.10', 'pm.', 'chandrapur', '(maharashtra)', '[india],', 'november', '27', '(ani):', 'people', 'injured', 'portion', 'foot-over', 'bridge', 'collapsed', 'atbalharshah', 'junctionrailway', 'station', 'chandrapur.', 'mentioned', 'fob', 'fallen', 'down,', 'pre-cast', 'slab', '(a', 'small', 'walkway', ').further', 'however,', 'causality', 'reported', 'far.', 'shifted', 'civil', 'hospital', 'aid.', '(ani)', 'reports', 'awaited.']","According to the railway officials, a part of the pre-cast slab of the foot over-bridge (FOB) at Balharshah, Nagpur division fell down today at around 5.10 pm.","Chandrapur (Maharashtra) [India], November 27 (ANI): Four people were injured after a portion of the foot-over bridge collapsed atBalharshah Junctionrailway station at Chandrapur.All have been shifted to Civil Hospital after giving first aid.However, no causality has been reported so far.According to the railway officials, a part of the pre-cast slab of the foot over-bridge (FOB) at Balharshah, Nagpur division fell down today at around 5.10 pm.Chief Public Relations Officer of Central Railways, Shivaji Sutar, said, A part of the Pre-case slab of FOB at Balharshah railway station connecting platforms 1 and 2 has fallen down at around 5.10 pm on Saturday. It is mentioned here that not the FOB has fallen down, it s a part of the pre-cast slab (a small part of the walkway ).Further reports are awaited. (ANI)","According to the railway officials, a part of the pre-cast slab of the foot over-bridge (FOB) at Balharshah, Nagpur division fell down today at around 5.10 pm. Chandrapur (Maharashtra) [India], November 27 (ANI): Four people were injured after a portion of the foot-over bridge collapsed atBalharshah Junctionrailway station at Chandrapur. It is mentioned here that not the FOB has fallen down, it s a part of the pre-cast slab (a small part of the walkway ).Further However, no causality has been reported so far. All have been shifted to Civil Hospital after giving first aid. (ANI) reports are awaited.",-0.06666666666666668,0.27380952380952384,Weakly Negative,Entertainment,No Section,According fell,India,Chandrapur,"Chandrapur, Maharashtra, India",20.0967555,79.50454752230621
https://aninews.in//news/national/general-news/additional-staff-deployed-to-run-diagnostics-labs-and-opd-services-at-aiims-delhi-dr-dk-sharma20221126180602,ANI Latest,"Additional staff deployed to run diagnostics , labs and OPD services at AIIMS Delhi - Dr DK Sharma",2022-11-26,15:56:22,No Source,No Source Link,https://aniportalimages.s3.amazonaws.com/media/details/ANI-20221126115328.jpg,Representative image,"['staff', 'institute', 'day', 'ransomware', 'superintendent', 'Diagnostics', 'work.We', 'managing', 'basis', 'wise', 'computer', 'explained.On', 'investigation', 'attack', 'internet', 'admission', 'discharge', 'transfer', 'till', 'down.Latest', 'mode', 'Admission', 'hospital', 'said.Earlier', 'failure', 'server', 'sample', 'collection.The', 'online', 'support', 'same.The', 'Informatics', 'inpatient', 'lab', 'billing', 'report', 'generation', 'appointment', 'etc.', 'team', 'law', 'enforcement', 'precaution', 'prevent', 'future', 'department', 'collection', 'administration', 'statement', 'New', 'Delhi', '[', 'India', ']', 'November', 'ANI', 'Institute', 'Medical', 'Sciences', 'AIIMS', 'Saturday', 'OPD', 'Dr', 'D', 'K', 'Sharma', 'ANI.He', 'Friday', 'National', 'Investigation', 'Agency', 'NIA', 'Computer', 'Emergency', 'Response', 'Team', 'CERT-IN', 'Police', 'Intelligence', 'Bureau', 'Central', 'CBI', 'Ministry', 'Home', 'Affairs', 'MHA', 'Thursday', 'Standard', 'SOP', 'SOPs', 'E-Hospital', 'Indent', 'Wednesday', 'Indian', 'CERT-In', 'Centre', 'NIC', 'Unique', 'Health', 'Identification']","['deployed', 'labs', 'remained', 'suspected', 'handle', 'increased', 'speaking', 'server', 'attended', 'required', 'sample', 'reports', 'dispatching', 'joined', 'alleged', 'including', 'probing', 'remain', 'issued', 'set', 'operating', 'reported', 'managing', 'measures', 'sought', 'running', 'working', 'informed', 'restore', 'statement.AIIMS', 'attacks', 'facing', 'regard', 'stated']","['26', '12,000', '7.30']",Dr D K Sharma,296,58,"['delhi', '[india],', 'november', '26', '(ani):', 'india', 'institute', 'medical', 'sciences', '(aiims),', 'delhi', 'authorities', 'saturday', 'deployed', 'additional', 'staff', 'diagnostics,', 'labs', 'opd', 'services', 'national', 'medical', 'institute', 'servers', 'remained', 'suspended', 'fourth', 'consecutive', 'day', 'suspected', 'ransomware', 'attack.the', 'institute', 'medical', 'superintendent,', 'sharma', 'redeployed', 'staff', 'handle', 'opd', 'diagnostics', 'services', 'increased', 'manual', 'work.we', 'deployed', 'additional', 'staff', 'people', 'opd', 'diagnostic', 'laboratories,', 'sharma,', 'speaking', 'ani.he', 'day', 'server', 'patients', 'comparison', 'digital', 'records.', 'patients', 'doctors', 'timely,', 'managing', 'records', 'manually', 'earlier.', 'days,', 'attended', '12,000', 'patients', 'daily', 'basis', '-', 'earlier', 'patients', 'required', 'appointment.we', 'opened', 'registers', 'serial', 'wise.', 'sample', 'reports', 'computer,', 'earlier', 'send', 'reports', 'e-hospital', 'areas.', 'reports', 'dispatching', 'directly,', 'medical', 'superintendent', 'explained.on', 'friday,', 'national', 'investigation', 'agency', '(nia)', 'joined', 'ongoing', 'investigation', 'alleged', 'malware', 'attack,', 'agencies', 'including', 'india', 'computer', 'emergency', 'response', 'team', '(cert-in),', 'delhi', 'police,', 'intelligence', 'bureau,', 'central', 'bureau', 'investigation', '(cbi)', 'ministry', 'affairs', '(mha),', 'probing', 'incident.the', 'internet', 'services', 'institute', 'remain', 'suspected', 'recommendations', 'investigation', 'agencies.on', 'thursday,', 'aiims', 'issued', 'fresh', 'set', 'standard', 'operating', 'procedures', '(sop)', 'admission,', 'discharge', 'transfer', 'patients', 'manually', 'hospital', 'till', 'e-hospital', 'down.latest', 'sops', 'manual', 'mode', 'till', 'e-hospital', 'down.', 'admission,', 'discharge', 'transfer', 'manually', 'aiims,', 'delhi.', 'indent', 'manually,', 'hospital', 'said.earlier', 'wednesday,', 'aiims', 'reported', 'failure', 'server.', 'server', 'wednesday,', 'officials', 'manually', 'managing', 'opd', 'sample', 'collection.the', 'aiims', 'measures', 'restore', 'online', 'services', 'sought', 'support', 'indian', 'computer', 'emergency', 'response', 'team', '(cert-in)', 'national', 'informatics', 'centre', '(nic)', 'same.the', 'servers', 'national', 'informatics', 'centre', 'e-hospital', 'aiims,', 'delhi', 'outpatient', 'inpatient', 'digital', 'hospital', 'services', 'including,', 'smart', 'lab,', 'billing,', 'report', 'generation,', 'appointment', 'etc.,', 'affected.', 'services', 'running', 'manual', 'mode', 'currently.national', 'informatics', 'centre', '(nic)', 'team', 'working', 'aiims', 'informed', 'ransomware', 'attack', 'reported', 'investigated', 'law', 'enforcement', 'authorities.', 'measures', 'restore', 'digital', 'services', 'support', 'sought', 'indian', 'computer', 'emergency', 'response', 'team', '(cert-in)', 'national', 'informatics', 'centre', '(nic),', 'aiims', 'statement.aiims', 'nic', 'precaution', 'prevent', 'attacks', 'future.', '7.30', 'pm,', 'hospital', 'services', 'running', 'manual', 'mode,', 'statement.the', 'staff', 'managing', 'outpatient', 'department', '(opd)', 'sample', 'collection', 'manually.', 'unique', 'health', 'identification', 'facing', 'problems', 'regard.', 'administration', 'facing', 'problems', 'admission', 'discharge', 'patients,', 'statement', 'stated.', '(ani)']","['7.30', 'pm,', 'hospital', 'services', 'running', 'manual', 'mode,', 'statement.', 'admission,', 'discharge', 'transfer', 'manually', 'aiims,', 'delhi.', 'institute', 'medical', 'superintendent,', 'sharma', 'redeployed', 'staff', 'handle', 'opd', 'diagnostics', 'services', 'increased', 'manual', 'work.', 'sample', 'reports', 'computer,', 'earlier', 'send', 'reports', 'e-hospital', 'areas.', 'patients', 'doctors', 'timely,', 'managing', 'records', 'manually', 'earlier.', 'administration', 'facing', 'problems', 'admission', 'discharge', 'patients,', 'statement', 'stated.', 'server', 'wednesday,', 'officials', 'manually', 'managing', 'opd', 'sample', 'collection.']","On Friday, the National Investigation Agency (NIA) also joined the ongoing investigation into the alleged malware attack, with agencies including the India Computer Emergency Response Team (CERT-IN), Delhi Police, Intelligence Bureau, Central Bureau of Investigation (CBI) and Ministry of Home Affairs (MHA), already probing the incident.","New Delhi [India], November 26 (ANI): All India Institute of Medical Sciences (AIIMS), Delhi authorities on Saturday said that they have deployed additional staff to run diagnostics, labs and OPD services at the national medical institute as its servers remained suspended for the fourth consecutive day due to a suspected ransomware attack.The institute s medical superintendent, Dr D K Sharma said that they have redeployed more staff to handle OPD and Diagnostics services due to increased manual work.We have deployed additional staff so that more people are available in OPD and diagnostic laboratories, said Sharma, while speaking to ANI.He further said that since the day server is down more patients have been seen in comparison to digital records. Patients want that doctors should see them timely, and we are managing records manually the way we used to do earlier. In the last three days, we have attended almost 12,000 patients on a daily basis - which is even more than earlier since the patients are not required to take an appointment.We opened our registers again and kept their serial no wise. We can see the sample reports on the computer, earlier we used to send those reports with the help of e-Hospital to different areas. Now we are taking those reports and dispatching them directly, the medical superintendent explained.On Friday, the National Investigation Agency (NIA) also joined the ongoing investigation into the alleged malware attack, with agencies including the India Computer Emergency Response Team (CERT-IN), Delhi Police, Intelligence Bureau, Central Bureau of Investigation (CBI) and Ministry of Home Affairs (MHA), already probing the incident.The internet services at the institute are likely to remain suspected on the recommendations from the investigation agencies.On Thursday, AIIMS issued a fresh set of Standard operating procedures (SOP) which says admission, discharge and transfer of patients will be done manually at the hospital till the E-Hospital is down.Latest SOPs that have to be followed in manual mode till E-Hospital is down. Admission, discharge and transfer are to be done manually at AIIMS, New Delhi. Indent to be done manually, the hospital said.Earlier on Wednesday, AIIMS reported a failure in its server. The server has been down since Wednesday, and the officials have been manually managing the OPD and sample collection.The AIIMS said that measures to restore the online services are on and it has also sought support from Indian Computer Emergency Response Team (CERT-In) and National Informatics Centre (NIC) on the same.The servers for the National Informatics Centre s e-Hospital being used at AIIMS, New Delhi was down due to which outpatient and inpatient digital hospital services including, smart lab, billing, report generation, appointment system etc., have been affected. All these services are running on manual mode currently.National Informatics Centre (NIC) team working at AIIMS has informed that this may be a ransomware attack which is being reported and will be investigated by appropriate law enforcement authorities. Measures are being taken to restore the digital services and support is being sought from Indian Computer Emergency Response Team (CERT-In) and National Informatics Centre (NIC), AIIMS said in a statement.AIIMS and NIC will take due precaution to prevent such attacks in future. As of 7.30 pm, the hospital services are running on manual mode, as per the statement.The staff has been managing the outpatient department (OPD) and sample collection manually. But those who do not have a Unique Health Identification are facing problems in this regard. The administration is also facing problems in admission and discharge of patients, the statement stated. (ANI)","As of 7.30 pm, the hospital services are running on manual mode, as per the statement. Admission, discharge and transfer are to be done manually at AIIMS, New Delhi. The institute s medical superintendent, Dr D K Sharma said that they have redeployed more staff to handle OPD and Diagnostics services due to increased manual work. We can see the sample reports on the computer, earlier we used to send those reports with the help of e-Hospital to different areas. Patients want that doctors should see them timely, and we are managing records manually the way we used to do earlier. The administration is also facing problems in admission and discharge of patients, the statement stated. The server has been down since Wednesday, and the officials have been manually managing the OPD and sample collection.",0.05476108487472122,0.34781172110717573,Weakly Positive,Tech,No Section,joined including probing,India,Delhi,"Delhi, Kotwali Tehsil, Central Delhi, Delhi, 110006, India",28.6517178,77.2219388
