News_URL,News_Source,News_Title,News_Date,News_Time,News_Authors,News_Authors_Source,News_Image_Link,News_Image_Caption,News_Proper_Nouns,News_Verbs,News_Cardinal_Digit,News_Target_Names,News_Total_Words,News_Total_Summary_Words,News_Word_Cloud,News_Summary_Word_Cloud,News_Short_Description,News_Detail,News_Summary,News_Polarity_Score,News_Subjectivity,News_Sentiments,News_Classification,News_Section,News_Event,News_Country,News_City,News_Address,News_Latitude,News_Longitude
https://aninews.in//news/national/general-news/delhi-air-continued-to-languor-in-very-poor-category-with-aqi-at-31720221128100851,ANI Latest,Delhi air continued to languor in 'Very poor' category with AQI at 317,2022-11-28,15:56:30,No Source,No Source Link,https://aniportalimages.s3.amazonaws.com/media/details/ANI-20221128043823.jpg,Visulas from the spot (Photo/ANI),"['capital', 'category', 'anAQIof', 'morning', 'theAQIwas', 'area', 'air', 'quality', 'withAQIat', 'tool', 'status', 'understand', 'number', 'colour.The', 'moderate', 'bevery', 'poorand', 'severe.Amid', 'review', 'progress', 'dynamic', 'model', 'forecast', 'surface', 'wind', 'direction', 'situation', 'scenario', 'New', 'Delhi', '[', 'India', ']', 'November', 'ANI', 'Air', 'Quality', 'Index', 'AQI', 'Very', 'System', 'Weather', 'Forecasting', 'Research', 'SAFAR', 'University', 'IIT', 'Airport', 'Terminal', 'Noida', 'Gurugram', 'Sub-Committee', 'Response', 'Action', 'Plan', 'GRAP', 'Stage', 'II', 'NCR.As', 'IMD/', 'IITM', 'Poor', 'North/', 'North-West', 'Ministry', 'Environment', 'Forest', 'Climate', 'Change', 'Commission']","['continued', '.This', 'fared', 'breathed', 'communicating', 'transforms', 'considered', 'continuing', 'invoking', 'Graded', 'held', 'meeting', 'implemented', 'provided', 'fluctuate', 'predicted', 'coming', 'said.The', 'watching']","['28', '317', '348', '273.Delhi', '323', '372.Meanwhile', '276.Air', '0', '100', '200', '300', '400', '500', '18']",,163,38,"['delhi', '[india],', 'november', '28', '(ani):', 'air', 'quality', '(aqi)', 'national', 'capital', 'continued', 'languor', 'poor', 'category', 'anaqiof', '317,', 'air', 'quality', 'weather', 'forecasting', '(safar).this', 'morning,', 'theaqiwas', '348', '(very', 'poor)', 'delhi', 'university', 'area,', 'air', 'quality', 'iit', 'delhi', 'poor', '273.delhi', 'airport', 'terminal', 'fared', 'anaqiof', '323', '(very', 'poor).similarly,', 'noida', 'breathed', 'poor', 'category', 'withaqiat', '372.meanwhile,', 'gurugram', 'poor', 'category', 'anaqiof', '276.air', 'quality', 'tool', 'effectively', 'communicating', 'air', 'quality', 'status', 'people', 'terms', 'easy', 'understand.', 'transforms', 'complex', 'air', 'quality', 'data', 'pollutants', 'single', 'number', '(index', 'value),', 'nomenclature', 'colour.the', 'air', 'quality', '0', '100', 'considered', 'good,', '100', '200', 'moderate,', '200', '300', 'poor,', '300', '400', 'bevery', 'poorand', '400', '500', 'considered', 'severe.amid', 'continuing', 'poor', 'air', 'quality,', 'sub-committee', 'invoking', 'actions', 'graded', 'response', 'action', 'plan', '(grap)', 'held', 'meeting', 'november', '18', 'review', 'progress', 'actions', 'implemented', 'stage', 'stage', 'grap', 'entire', 'ncr.as', 'dynamic', 'model', 'weather/', 'meteorological', 'forecast', 'provided', 'imd/', 'iitm,', 'air', 'quality', 'fluctuate', 'poor', 'lower', 'poor', 'categories', 'days.', 'predominant', 'surface', 'wind', 'predicted', 'coming', 'north/', 'north-west', 'direction', 'delhi,', 'ministry', 'environment,', 'forest', 'climate', 'change', 'said.the', 'sub-committee', 'commission', 'closely', 'watching', 'situation', 'review', 'air', 'quality', 'scenario', 'accordingly.', '(ani)']","['transforms', 'complex', 'air', 'quality', 'data', 'pollutants', 'single', 'number', '(index', 'value),', 'nomenclature', 'colour.', 'predominant', 'surface', 'wind', 'predicted', 'coming', 'north/', 'north-west', 'direction', 'delhi,', 'ministry', 'environment,', 'forest', 'climate', 'change', 'said.', 'sub-committee', 'commission', 'closely', 'watching', 'situation', 'review', 'air', 'quality', 'scenario', 'accordingly.', '(ani)']","This morning, the AQI was 348 (very poor) at the Delhi University area, whereas the air quality at the IIT Delhi was under 'poor' at 273.","New Delhi [India], November 28 (ANI): The overall Air Quality Index (AQI) in the national capital continued to languor in the  Very poor  category with anAQIof 317, as per the System of Air Quality and Weather Forecasting And Research (SAFAR).This morning, theAQIwas 348 (very poor) at the Delhi University area, whereas the air quality at the IIT Delhi was under  poor  at 273.Delhi Airport Terminal fared no better with anAQIof 323 (very poor).Similarly, Noida too breathed into the  poor category  withAQIat 372.Meanwhile, Gurugram was better placed in the  poor category  with anAQIof 276.Air Quality Index is a tool for effectively communicating air quality status to people in terms that are easy to understand. It transforms complex air quality data of various pollutants into a single number (index value), nomenclature and colour.The Air Quality Index from 0 to 100 is considered as good, while from 100 to 200 it is moderate, from 200 to 300 it is poor, and from 300 to 400 it is said to bevery poorand from 400 to 500 or above it is considered as severe.Amid continuing poor air quality, the Sub-Committee for invoking actions under the Graded Response Action Plan (GRAP) held a meeting on November 18 to review the progress of the actions implemented under Stage II along with Stage I of the GRAP in the entire NCR.As per the dynamic model and weather/ meteorological forecast provided by IMD/ IITM, the overall air quality is likely to fluctuate largely between  Poor  to the lower end of the  Very Poor  categories in the next few days. The predominant surface wind is predicted to be coming from the North/ North-West direction in Delhi, the Ministry of Environment, Forest and Climate Change said.The Sub-Committee of the Commission is closely watching the situation and will review the air quality scenario accordingly. (ANI)","It transforms complex air quality data of various pollutants into a single number (index value), nomenclature and colour. The predominant surface wind is predicted to be coming from the North/ North-West direction in Delhi, the Ministry of Environment, Forest and Climate Change said. The Sub-Committee of the Commission is closely watching the situation and will review the air quality scenario accordingly. (ANI)",-0.06324819624819625,0.4754134199134198,Weakly Negative,Sport,No Section,,India,Delhi,"Delhi, Kotwali Tehsil, Central Delhi, Delhi, 110006, India",28.6517178,77.2219388
https://aninews.in//news/national/general-news/woman-succumbs-to-injuries-in-foot-overbridge-collapse-at-maharashtras-ballarshah-railway-station20221128092006,ANI Latest,Woman succumbs to injuries in foot overbridge collapse at  Maharashtra's Ballarshah railway station,2022-11-28,15:56:31,No Source,No Source Link,https://aniportalimages.s3.amazonaws.com/media/details/ANI-20221128025449.jpg,Visuals from the spot (Photo/ANI),"['woman', 'portion', 'foot-over', 'bridge', 'station', 'treatment.A', 'slab', 'railway', 'district', 'treatment', 'foot', 'overbridge', 'collapse', 'officer', 'today.Earlier', 'mishap.Yesterday', 'lakh', 'inquiry', 'ascertain', 'over-bridge', 'division', 'time', 'fall', 'slabof', 'walkway', 'Chandrapur', 'Maharashtra', 'India', ']', 'November', 'ANI', 'Junctionrailway', 'Sunday', 'Foot', 'Over', 'Bridge', 'FOB', 'Balharshah', 'District', 'Railways', 'Rs', 'Civil', 'Hospital', 'Central', 'Railway', 'CR', 'Nagpur', 'Saturday', 'Chief', 'Public', 'Relations', 'Officer', 'Shivaji', 'Sutar']","['[', 'succumbed', 'sustained', 'collapsed', 'Monday.According', 'died', 'connecting', 'evening.A', 'injured', 'reported', 'announced', 'mishap.All', 'shifted', 'initiated', 'mishap.According', 'bridge', 'fallen', 'mentioned']","['28', '1', '50,000', '5.10', '2']",Nagpur,141,80,"['chandrapur', '(maharashtra)', '[india],', 'november', '28', '(ani):', '48-year-old', 'woman', 'succumbed', 'injuries', 'sustained', 'portion', 'foot-over', 'bridge', 'collapsed', 'atbalharshah', 'junctionrailway', 'station', 'chandrapur,', 'officials', 'monday.according', 'officials,', 'woman', 'died', 'late', 'sunday', 'treatment.a', 'slab', 'foot', 'bridge', '(fob)', 'connecting', 'platforms', 'balharshah', 'railway', 'station', 'maharashtra', 'chandrapur', 'district', 'collapsed', 'sunday', 'evening.a', '48-year-old', 'woman', 'succumbed', 'injuries', 'treatment.', 'injured', 'foot', 'overbridge', 'collapse', 'balharshah', 'railway', 'station', 'sunday,', 'chandrapur', 'district', 'officer', 'today.earlier', 'people', 'reported', 'sustained', 'injuries', 'mishap.yesterday,', 'indian', 'railways', 'announced', 'ex-gratia', '1', 'lakh', 'grievously', 'injured', '50,000', 'sustained', 'simple', 'injuries', 'mishap.all', 'sustained', 'injuries', 'shifted', 'civil', 'hospital', 'aid.the', 'central', 'railway', '(cr)', 'initiated', 'inquiry', 'ascertain', 'mishap.according', 'railway', 'officials,', 'thepre-cast', 'slabof', 'foot', 'over-bridge', '(fob)', 'balharshah,', 'nagpur', 'division', 'collapsed', 'sunday', '5.10', 'pm.', 'people', 'bridge', 'time', 'fall', 'railway', 'tracks.a', 'thepre-cast', 'slabof', 'fob', 'balharshah', 'railway', 'station', 'connecting', 'platforms', '1', '2', 'fallen', '5.10', 'saturday.', 'mentioned', 'fob', 'fallen', 'down,', 'thepre-cast', 'slab(a', 'small', 'walkway),', 'chief', 'public', 'relations', 'officer', 'central', 'railway', 'shivaji', 'sutar', 'earlier.', '(ani)']","['railway', 'officials,', 'thepre-cast', 'slabof', 'foot', 'over-bridge', '(fob)', 'balharshah,', 'nagpur', 'division', 'collapsed', 'sunday', '5.10', 'pm.', 'yesterday,', 'indian', 'railways', 'announced', 'ex-gratia', '1', 'lakh', 'grievously', 'injured', '50,000', 'sustained', 'simple', 'injuries', 'mishap.', 'thepre-cast', 'slabof', 'fob', 'balharshah', 'railway', 'station', 'connecting', 'platforms', '1', '2', 'fallen', '5.10', 'saturday.', 'slab', 'foot', 'bridge', '(fob)', 'connecting', 'platforms', 'balharshah', 'railway', 'station', 'maharashtra', 'chandrapur', 'district', 'collapsed', 'sunday', 'evening.', '48-year-old', 'woman', 'succumbed', 'injuries', 'treatment.', 'injured', 'foot', 'overbridge', 'collapse', 'balharshah', 'railway', 'station', 'sunday,', 'chandrapur', 'district', 'officer', 'today.', 'central', 'railway', '(cr)', 'initiated', 'inquiry', 'ascertain', 'mishap.']",A 48-year-old woman succumbed to injuries sustained after a portion of the foot-over bridge collapsed at Balharshah Junction railway station in Chandrapur.,"Chandrapur (Maharashtra) [India], November 28 (ANI): A 48-year-old woman succumbed to her injuries sustained after a portion of the foot-over bridge collapsed atBalharshah Junctionrailway station in Chandrapur, officials said on Monday.According to the officials, the woman died late Sunday during treatment.A slab of a Foot Over Bridge (FOB) connecting two platforms at the Balharshah railway station in Maharashtra s Chandrapur district collapsed on Sunday evening.A 48-year-old woman succumbed to injuries during treatment. She was injured during the foot overbridge collapse at Balharshah railway station on Sunday, Chandrapur District information officer said today.Earlier four people were reported to have sustained injuries during the mishap.Yesterday, the Indian Railways announced ex-gratia of Rs 1 lakh to those grievously injured and Rs 50,000 to those who sustained simple injuries in the mishap.All who sustained injuries were shifted to Civil Hospital after giving first aid.The Central Railway (CR) has initiated an inquiry to ascertain the cause of the mishap.According to railway officials, a part of thepre-cast slabof the foot over-bridge (FOB) at Balharshah, Nagpur division collapsed on Sunday at around 5.10 pm. This resulted in people who were using the bridge at that time to fall on the railway tracks.A part of thepre-cast slabof FOB at Balharshah railway station connecting platforms 1 and 2 have fallen down at around 5.10 pm on Saturday. It is mentioned here that not the FOB has fallen down, it s a part of thepre-cast slab(a small part of the walkway), Chief Public Relations Officer of Central Railway Shivaji Sutar had said earlier. (ANI)","According to railway officials, a part of thepre-cast slabof the foot over-bridge (FOB) at Balharshah, Nagpur division collapsed on Sunday at around 5.10 pm. Yesterday, the Indian Railways announced ex-gratia of Rs 1 lakh to those grievously injured and Rs 50,000 to those who sustained simple injuries in the mishap. A part of thepre-cast slabof FOB at Balharshah railway station connecting platforms 1 and 2 have fallen down at around 5.10 pm on Saturday. A slab of a Foot Over Bridge (FOB) connecting two platforms at the Balharshah railway station in Maharashtra s Chandrapur district collapsed on Sunday evening. A 48-year-old woman succumbed to injuries during treatment. She was injured during the foot overbridge collapse at Balharshah railway station on Sunday, Chandrapur District information officer said today. The Central Railway (CR) has initiated an inquiry to ascertain the cause of the mishap.",-0.1282828282828283,0.39408369408369415,Weakly Negative,Entertainment,No Section,succumbed sustained collapsed,India,Chandrapur,"Chandrapur, Maharashtra, India",20.0967555,79.50454752230621
https://aninews.in//news/national/politics/mainpuri-election-scene-heats-up-as-cm-yogi-set-to-enter-campaign20221128094102,ANI Latest,Mainpuri election scene heats up as CM Yogi set to enter campaign,2022-11-28,15:56:32,No Source,No Source Link,https://aniportalimages.s3.amazonaws.com/media/details/ANI-20221128031146.jpg,Uttar Pradesh Chief Minister Yogi Adityanath (File Photo),"['heat', 'campaign', 'meeting', 'place', 'party', 'bastion.CM', 'influence', 'tension', 'by-election', 'increase', 'arrival', 'fact', 'constituency', 'situation', 'emphasis', 'stronghold.Earlier', 'mood', 'favor', 'stone', 'workers.The', 'high-profile', 'seat', 'contest', 'candidate', 'wife', 'president', 'leader', 'here.At', 'force', 'victory', 'margin', 'low', 'death', 'conversation', 'voter', 'time', 'fight', 'reason', 'village', 'vigorously.Since', 'nomination', 'street', 'change', 'support', 'Lucknow', 'Uttar', 'Pradesh', 'India', ']', 'November', 'ANI', 'Mainpuri', 'UP', 'Chief', 'Minister', 'Yogi', 'Adityanath', 'Bharatiya', 'Janata', 'Party', 'BJP', 'MLAs', 'Samajwadi', 'Narsingh', 'Yadav', 'Inter', 'College', 'Karhal', 'December.The', 'Akhilesh', 'CM', 'SP', 'President', 'Deputy', 'MinisterKeshav', 'Prasad', 'Mauryaheld', 'CMBrijesh', 'Pathakhas', 'Apart', 'Chaudhary', 'Bhupendra', 'Singh', 'General', 'Secretary', 'Organization', 'Dharampal', 'Lok', 'Sabha', 'MP', 'Raghuraj', 'Shakya', 'Dimple', 'Yadav.The', 'Mulayam', 'SP.This', 'Jaswantnagar', 'Shivpal', 'Ramgopal', 'Bharat', 'Deep']","['[', 'scheduled', 'unleashed', 'fight', 'address', 'expected', 'till', 'facing', 'starting', 'considered', 'holding', 'turn', 'leaving', 'witnessing', 'changed', 'fielding', 'putting', 'believed', 'easy', 'held', 'admitted', 'visiting', 'SP', 'including', 'campaigning', 'visited', 'public', 'mind']","['28', '28.The', '3', '7', '10']","Dimple Yadav, Ramgopal Yadav, Bharat Deep, Mainpuri Lok Sabha, Lok Sabha, Mulayam, Karhal, Raghuraj Singh Shakya",275,66,"['lucknow', '(uttar', 'pradesh)', '[india],', 'november', '28', '(ani):', 'heat', 'quotient', 'high', 'stakes', 'mainpuri', 'elections', 'chief', 'minister', 'yogi', 'adityanath', 'enters', 'campaign', 'public', 'meeting', 'mainpuri', 'scheduled', 'place', 'november', '28.the', 'bharatiya', 'janata', 'party', '(bjp)', 'unleashed', 'army', 'mlas', 'ministers', 'fight', 'samajwadi', 'party', 'traditional', 'bastion.cm', 'yogi', 'address', 'public', 'meeting', 'narsingh', 'yadav', 'inter', 'college,', 'karhal.', 'expected', 'yogi', 'adityanath', 'influence', 'minds', 'people', 'mainpuri', 'continuously', 'till', '3', 'december.the', 'tension', 'akhilesh', 'yadav,', 'facing', 'political', 'heat', 'mainpuri', 'by-election,', 'increase', 'arrival', 'yogi.', 'fact,', 'yogi', 'adityanath', 'starting', 'public', 'meeting', 'constituency', 'akhilesh', 'yadav.', 'situation,', 'president', 'emphasis', 'karhal,', 'considered', 'stronghold.earlier,', 'uttar', 'pradesh', 'deputy', 'chief', 'ministerkeshav', 'prasad', 'mauryaheld', 'meetings', 'mainpuri.', 'deputy', 'cmbrijesh', 'pathakhas', 'holding', 'meetings', 'mainpuri', 'consecutive', 'days', 'turn', 'voter', 'mood', 'bjp', 'favor.', 'this,', 'party', 'president', 'chaudhary', 'bhupendra', 'singh', 'general', 'secretary', 'organization', 'dharampal', 'singh', 'leaving', 'stone', 'unturned', 'influence', 'workers.the', 'lok', 'sabha', 'by-election', 'mainpuri', 'high-profile', 'one.', 'seat', 'witnessing', 'main', 'contest', 'bjp', 'candidate', 'mp', 'raghuraj', 'singh', 'shakya', 'dimple', 'yadav,', 'wife', 'samajwadi', 'party', 'president', 'akhilesh', 'yadav.', 'earlier', 'by-election', 'considered', 'easy', 'dimple', 'yadav.the', 'bharatiya', 'janata', 'party', 'changed', 'pre-poll', 'predictions', 'fielding', 'veteran', 'leader', 'raghuraj', 'singh', 'shakya', 'here.at', 'present,', 'parties', 'putting', 'force', 'campaign.', 'late', 'mulayam', 'singh', 'yadav', 'continuous', 'mp', 'here.', 'however,', 'lok', 'sabha', 'elections,', 'mulayam', 'victory', 'margin', 'low.', 'then,', 'believed', 'mulayam,', 'mainpuri', 'easy', 'sp.this', 'clear', 'by-elections', 'held', 'death', 'mulayam', 'singh', 'yadav.', 'political', 'pundits', 'believed,', 'matter', '50-50.', 'conversation', 'jaswantnagar', 'assembly,', 'elderly', 'voter', 'admitted', 'time', 'fight', 'tough.', 'reason', 'samajwadi', 'party', 'hold', 'meetings', 'mainpuri', 'local', 'workers', 'votes,', 'bigger', 'campaign.presently', 'situation', 'akhilesh', 'yadav', 'visiting', 'village', 'times', 'assembly.', 'them,', 'big', 'leaders', 'including', 'dimple', 'yadav,', 'shivpal', 'yadav,', 'ramgopal', 'yadav', 'campaigning', 'vigorously.since', 'nomination,', 'party', 'candidate', 'raghuraj', 'singh', 'shakya', 'campaigning', 'intensively', '7', '10', 'pm.', 'local', 'bjp', 'leader', 'bharat', 'deep,', 'said,', 'candidate', 'visited', 'mainpuri', 'lok', 'sabha', 'street', 'street.', 'public', 'mind', 'change.', 'support', 'people', 'mainpuri', 'him.', '(ani)']","['them,', 'big', 'leaders', 'including', 'dimple', 'yadav,', 'shivpal', 'yadav,', 'ramgopal', 'yadav', 'campaigning', 'vigorously.', 'tension', 'akhilesh', 'yadav,', 'facing', 'political', 'heat', 'mainpuri', 'by-election,', 'increase', 'arrival', 'yogi.', 'local', 'bjp', 'leader', 'bharat', 'deep,', 'said,', 'candidate', 'visited', 'mainpuri', 'lok', 'sabha', 'street', 'street.', 'however,', 'lok', 'sabha', 'elections,', 'mulayam', 'victory', 'margin', 'low.', 'situation,', 'president', 'emphasis', 'karhal,', 'considered', 'stronghold.', 'political', 'pundits', 'believed,', 'matter', '50-50.', 'nomination,', 'party', 'candidate', 'raghuraj', 'singh', 'shakya', 'campaigning', 'intensively', '7', '10', 'pm.']","CM Yogi is going to address a public meeting at Narsingh Yadav Inter College, Karhal. It is expected that Yogi Adityanath will try to influence the minds of the people of Mainpuri continuously till 3 December.","Lucknow (Uttar Pradesh) [India], November 28 (ANI): The heat quotient of the high stakes Mainpuri elections is going go up further as UP Chief Minister Yogi Adityanath enters the campaign with his first public meeting in Mainpuri scheduled to take place on November 28.The Bharatiya Janata Party (BJP) has already unleashed its army of MLAs and ministers to fight the Samajwadi party in its traditional bastion.CM Yogi is going to address a public meeting at Narsingh Yadav Inter College, Karhal. It is expected that Yogi Adityanath will try to influence the minds of the people of Mainpuri continuously till 3 December.The tension of Akhilesh Yadav, who is facing political heat in the Mainpuri by-election, is going to increase after the arrival of Yogi. In fact, CM Yogi Adityanath is starting his first public meeting from the constituency of Akhilesh Yadav. In such a situation, the SP President will have to put more emphasis on Karhal, which is considered an SP stronghold.Earlier, Uttar Pradesh Deputy Chief MinisterKeshav Prasad Mauryaheld two meetings in Mainpuri. Deputy CMBrijesh Pathakhas been holding meetings in Mainpuri for two consecutive days to turn voter mood in BJP s favor. Apart from this, Party President Chaudhary Bhupendra Singh and General Secretary Organization Dharampal Singh are leaving no stone unturned to influence the workers.The Lok Sabha by-election in Mainpuri is a high-profile one. The seat is witnessing a main contest between BJP candidate former MP Raghuraj Singh Shakya and Dimple Yadav, the wife of Samajwadi Party president Akhilesh Yadav. Earlier this by-election was considered easy for Dimple Yadav.The Bharatiya Janata Party has changed all the pre-poll predictions by fielding veteran leader Raghuraj Singh Shakya here.At present, both parties are putting their full force into the campaign. Late Mulayam Singh Yadav was a continuous MP from here. However, in the last Lok Sabha elections, Mulayam s victory margin was very low. Since then, it was believed that after Mulayam, Mainpuri would not be easy for the SP.This became clear only in the by-elections that were held after the death of Mulayam Singh Yadav. If political pundits are to be believed, now the matter is 50-50. During a conversation in the Jaswantnagar assembly, an elderly voter admitted that this time the fight is tough. This is the reason Samajwadi Party which used to hold one or two meetings in Mainpuri and only local workers used to ask for votes, is doing a much bigger campaign.Presently the situation is that Akhilesh Yadav himself is visiting the same village many times in his assembly. Apart from them, all the big leaders of SP including Dimple Yadav, Shivpal Yadav, and Ramgopal Yadav are campaigning vigorously.Since the nomination, party candidate Raghuraj Singh Shakya has been campaigning intensively from 7 am to 10 pm. A local BJP leader Bharat Deep, said,  Our candidate has visited most of the Mainpuri Lok Sabha by going street by street. They say that the public has now made up its mind for a change. The support of the people of Mainpuri is with him. (ANI)","Apart from them, all the big leaders of SP including Dimple Yadav, Shivpal Yadav, and Ramgopal Yadav are campaigning vigorously. The tension of Akhilesh Yadav, who is facing political heat in the Mainpuri by-election, is going to increase after the arrival of Yogi. A local BJP leader Bharat Deep, said,  Our candidate has visited most of the Mainpuri Lok Sabha by going street by street. However, in the last Lok Sabha elections, Mulayam s victory margin was very low. In such a situation, the SP President will have to put more emphasis on Karhal, which is considered an SP stronghold. If political pundits are to be believed, now the matter is 50-50. Since the nomination, party candidate Raghuraj Singh Shakya has been campaigning intensively from 7 am to 10 pm.",0.07447293447293447,0.3685042735042735,Weakly Positive,Politics,No Section,going address expected try influence,India,Mainpuri,"Mainpuri, Uttar Pradesh, India",27.2098219,79.04813700847944
https://aninews.in//news/national/general-news/slabs-of-foot-overbridge-fall-off-at-balharshah-railway-junction-in-maharashtra20221127184805,ANI Latest,Slabs of foot overbridge fall off at Balharshah railway junction in Maharashtra,2022-11-27,15:56:33,No Source,No Source Link,https://aniportalimages.s3.amazonaws.com/media/details/ANI-20221127131754.jpg,Visuals from the spot (Photo/ANI),"['portion', 'bridge', 'station', 'causality', 'Chandrapur', 'Maharashtra', 'India', ']', 'November', 'ANI', 'Junctionrailway', 'Chandrapur.No']","['[', 'feared', 'collapsed', 'reported', 'awaited']",['27'],,23,23,"['chandrapur', '(maharashtra)', '[india],', 'november', '27', '(ani):', 'passengers', 'feared', 'injured', 'portion', 'foot-over', 'bridge', 'collapsed', 'atbalharshah', 'junctionrailway', 'station', 'chandrapur.no', 'causality', 'reported', 'far.further', 'reports', 'awaited.', '(ani)']","['chandrapur', '(maharashtra)', '[india],', 'november', '27', '(ani):', 'passengers', 'feared', 'injured', 'portion', 'foot-over', 'bridge', 'collapsed', 'atbalharshah', 'junctionrailway', 'station', 'chandrapur.', 'causality', 'reported', 'far.', 'reports', 'awaited.', '(ani)']",Several passengers are feared injured after a portion of the foot-over bridge collapsed at Balharshah Junction railway station in Chandrapur.,"Chandrapur (Maharashtra) [India], November 27 (ANI): Several passengers are feared injured after a portion of the foot-over bridge collapsed atBalharshah Junctionrailway station in Chandrapur.No causality has been reported so far.Further reports are awaited. (ANI)","Chandrapur (Maharashtra) [India], November 27 (ANI): Several passengers are feared injured after a portion of the foot-over bridge collapsed atBalharshah Junctionrailway station in Chandrapur. No causality has been reported so far. Further reports are awaited. (ANI)",0.0,0.0,Neutral,Sport,No Section,feared injured collapsed,India,Chandrapur,"Chandrapur, Maharashtra, India",20.0967555,79.50454752230621
